# name: test/sql/condition_cache_invalidation.test
# description: Test cache invalidation on DML operations
# group: [sql]

require query_condition_cache

# Create table with multiple row groups (122880 rows per RG, 5 RGs)
statement ok
CREATE TABLE t AS SELECT i AS id, i % 100 AS val FROM range(500000) t(i);

# Build cache for a predicate that hits all 5 row groups
query I
SELECT status FROM condition_cache_build('t', 'val = 42');
----
Cache Built: 245/245 vectors, 5/5 row groups

# Verify 5 row groups are cached
query I
SELECT * FROM condition_cache_info('t', 'val = 42');
----
5

# DELETE is treated as a delete-like rewrite, so the whole table cache is cleared
statement ok
DELETE FROM t WHERE id = 42;

# No cache entry remains for this predicate
query I
SELECT * FROM condition_cache_info('t', 'val = 42');
----
0

# Rebuild restores all 5 row groups
query I
SELECT status FROM condition_cache_build('t', 'val = 42');
----
Cache Built: 245/245 vectors, 5/5 row groups

query I
SELECT * FROM condition_cache_info('t', 'val = 42');
----
5

# UPDATE a row in RG0 should invalidate only RG0
statement ok
UPDATE t SET val = 999 WHERE id = 200;

query I
SELECT * FROM condition_cache_info('t', 'val = 42');
----
4

# Rebuild
query I
SELECT status FROM condition_cache_build('t', 'val = 42');
----
Cache Built: 245/245 vectors, 5/5 row groups

# INSERT appends to the last row group — only that RG is invalidated
# Build a predicate that only matches RG0, but caches all row groups
query I
SELECT status FROM condition_cache_build('t', 'id < 3000');
----
Cache Built: 2/245 vectors, 1/5 row groups

query I
SELECT * FROM condition_cache_info('t', 'id < 3000');
----
1

statement ok
INSERT INTO t VALUES (999999, 0);

# The known-empty last row group is invalidated, but RG0 and the other known-empty
# row groups remain cached
query I
SELECT * FROM condition_cache_info('t', 'id < 3000');
----
1

# But 'val = 42' cache lost its last RG (RG4 where new row was appended)
query I
SELECT * FROM condition_cache_info('t', 'val = 42');
----
4

# Cross-table isolation: DML on table B should not affect table A's cache
statement ok
CREATE TABLE t2 AS SELECT i AS id, i % 10 AS val FROM range(1000) t(i);

# Rebuild t's cache fully
query I
SELECT status FROM condition_cache_build('t', 'val = 42');
----
Cache Built: 245/245 vectors, 5/5 row groups

statement ok
DELETE FROM t2 WHERE id < 100;

# t's cache is unaffected by t2's DML
query I
SELECT * FROM condition_cache_info('t', 'val = 42');
----
5

# No cache entry returns 0
query I
SELECT * FROM condition_cache_info('t2', 'val = 5');
----
0

# ============================================================================
# TRUNCATE should clear the table cache and remain correct
# ============================================================================

statement ok
CREATE TABLE t_trunc AS SELECT i AS id, i % 100 AS val FROM range(500000) t(i);

query I
SELECT status FROM condition_cache_build('t_trunc', 'val = 42');
----
Cache Built: 245/245 vectors, 5/5 row groups

query I
SELECT * FROM condition_cache_info('t_trunc', 'val = 42');
----
5

statement ok
TRUNCATE t_trunc;

# Cache entry is cleared
query I
SELECT * FROM condition_cache_info('t_trunc', 'val = 42');
----
0

# Empty table still returns 0 rows
query I
SELECT count(*) FROM t_trunc WHERE val = 42;
----
0

# ============================================================================
# DROP TABLE should not crash with active cache entries
# ============================================================================

statement ok
CREATE TABLE t_drop AS SELECT i AS id, i % 100 AS val FROM range(500000) t(i);

query I
SELECT status FROM condition_cache_build('t_drop', 'val = 42');
----
Cache Built: 245/245 vectors, 5/5 row groups

statement ok
DROP TABLE t_drop;

# Recreate table — different OID, stale entries from old OID are orphaned but harmless
statement ok
CREATE TABLE t_drop AS SELECT i AS id, i % 10 AS val FROM range(1000) t(i);

query I
SELECT count(*) FROM t_drop WHERE val = 5;
----
100

# ============================================================================
# CHECKPOINT vacuum must not leave stale cache entries that prune moved rows
# ============================================================================

statement ok
SET use_query_condition_cache = true;

statement ok
CREATE TABLE t_checkpoint AS
SELECT i AS id, CASE WHEN i >= 245760 THEN 1 ELSE 0 END AS val
FROM range(368640) t(i);

query I
SELECT status FROM condition_cache_build('t_checkpoint', 'val=1');
----
Cache Built: 60/180 vectors, 1/3 row groups

query I
SELECT count(*) FROM t_checkpoint WHERE val = 1;
----
122880

statement ok
DELETE FROM t_checkpoint WHERE id < 122880;

statement ok
CHECKPOINT;

query I
SELECT count(*) FROM t_checkpoint WHERE val = 1;
----
122880
