# name: test/sql/condition_cache_invalidation.test
# description: Test cache invalidation on DML operations
# group: [sql]

require query_condition_cache

# Create table with multiple row groups (122880 rows per RG, 5 RGs)
statement ok
CREATE TABLE t AS SELECT i AS id, i % 100 AS val FROM range(500000) t(i);

# Build cache for a predicate that hits all 5 row groups
query I
SELECT status FROM condition_cache_build('t', 'val = 42');
----
Cache Built: 245/245 vectors, 5/5 row groups

# Verify 5 row groups are cached
query I
SELECT * FROM condition_cache_info('t', 'val = 42');
----
5

# DELETE a row in RG0 should invalidate only RG0
statement ok
DELETE FROM t WHERE id = 42;

# Only 4 row groups remain cached (RG0 invalidated)
query I
SELECT * FROM condition_cache_info('t', 'val = 42');
----
4

# Rebuild restores all 5 row groups
query I
SELECT status FROM condition_cache_build('t', 'val = 42');
----
Cache Built: 245/245 vectors, 5/5 row groups

query I
SELECT * FROM condition_cache_info('t', 'val = 42');
----
5

# UPDATE a row in RG0 should invalidate only RG0
statement ok
UPDATE t SET val = 999 WHERE id = 200;

query I
SELECT * FROM condition_cache_info('t', 'val = 42');
----
4

# Rebuild
query I
SELECT status FROM condition_cache_build('t', 'val = 42');
----
Cache Built: 245/245 vectors, 5/5 row groups

# INSERT appends to the last row group — only that RG is invalidated
# Build a predicate that only hits RG0
query I
SELECT status FROM condition_cache_build('t', 'id < 3000');
----
Cache Built: 2/245 vectors, 1/5 row groups

query I
SELECT * FROM condition_cache_info('t', 'id < 3000');
----
1

statement ok
INSERT INTO t VALUES (999999, 0);

# RG0 cache (for 'id < 3000') should be preserved since insert only affects the last RG
query I
SELECT * FROM condition_cache_info('t', 'id < 3000');
----
1

# But 'val = 42' cache lost its last RG (RG4 where new row was appended)
query I
SELECT * FROM condition_cache_info('t', 'val = 42');
----
4

# Cross-table isolation: DML on table B should not affect table A's cache
statement ok
CREATE TABLE t2 AS SELECT i AS id, i % 10 AS val FROM range(1000) t(i);

# Rebuild t's cache fully
query I
SELECT status FROM condition_cache_build('t', 'val = 42');
----
Cache Built: 245/245 vectors, 5/5 row groups

statement ok
DELETE FROM t2 WHERE id < 100;

# t's cache is unaffected by t2's DML
query I
SELECT * FROM condition_cache_info('t', 'val = 42');
----
5

# No cache entry returns 0
query I
SELECT * FROM condition_cache_info('t2', 'val = 5');
----
0

# ============================================================================
# TRUNCATE should not crash and stale entries should be harmless
# ============================================================================

statement ok
CREATE TABLE t_trunc AS SELECT i AS id, i % 100 AS val FROM range(500000) t(i);

query I
SELECT status FROM condition_cache_build('t_trunc', 'val = 42');
----
Cache Built: 245/245 vectors, 5/5 row groups

query I
SELECT * FROM condition_cache_info('t_trunc', 'val = 42');
----
5

statement ok
TRUNCATE t_trunc;

# After truncate, cache entry may still exist but queries must still be correct
# (empty table returns 0 rows regardless of stale cache)
query I
SELECT count(*) FROM t_trunc WHERE val = 42;
----
0

# ============================================================================
# DROP TABLE should not crash with active cache entries
# ============================================================================

statement ok
CREATE TABLE t_drop AS SELECT i AS id, i % 100 AS val FROM range(500000) t(i);

query I
SELECT status FROM condition_cache_build('t_drop', 'val = 42');
----
Cache Built: 245/245 vectors, 5/5 row groups

statement ok
DROP TABLE t_drop;

# Recreate table — different OID, stale entries from old OID are orphaned but harmless
statement ok
CREATE TABLE t_drop AS SELECT i AS id, i % 10 AS val FROM range(1000) t(i);

query I
SELECT count(*) FROM t_drop WHERE val = 5;
----
100
